{
  "$schema": "https://json-schema.org/draft/2020-12/schema",
  "$id": "review-report.schema.json",
  "title": "Coach v9 Review Report",
  "description": "Review report emitted by a reviewer agent at a phase boundary and ingested by coach. Producer: reviewer agent (#526). Consumer: coach intake validator (#N2), runtime `atdd agent review` (#N5), judge call site #2 (#N4). Spec: atdd-coach-spec-v9.md §6.3 (verdict routing), §7.4 (schema + hard rules), §7.7 (schema inventory). Single-doc JSON written to `.atdd/runtime/agents/<id>/reviews/<review_id>.json` only after passing intake validation.",
  "type": "object",
  "required": [
    "review_id",
    "target_commit",
    "reviewer_agent_id",
    "wmbt_urn",
    "phase",
    "verdict",
    "tier1_risk_score",
    "findings",
    "ac_coverage",
    "summary"
  ],
  "additionalProperties": false,
  "properties": {
    "review_id": {
      "type": "string",
      "minLength": 1,
      "description": "Unique identifier for this review (typically a UUID)."
    },
    "target_commit": {
      "type": "string",
      "minLength": 7,
      "description": "Commit SHA the review was performed against (minimum 7 chars)."
    },
    "reviewer_agent_id": {
      "type": "string",
      "minLength": 1,
      "description": "Registered agent id of the reviewer that produced this report."
    },
    "wmbt_urn": {
      "type": "string",
      "minLength": 1,
      "description": "URN of the WMBT this review covers (e.g. `wmbt:review-phase-boundaries:D002`)."
    },
    "phase": {
      "type": "string",
      "enum": ["RED", "GREEN", "SMOKE", "REFACTOR"],
      "description": "ATDD lifecycle phase boundary at which this review was requested."
    },
    "verdict": {
      "type": "string",
      "enum": ["pass", "concern", "fail"],
      "description": "Overall verdict. `pass` → next state; `fail` → respawn with feedback; `concern` → judge call site #2. Hard rules at intake prevent `pass` when ACs are uncovered or strict findings remain."
    },
    "tier1_risk_score": {
      "type": "integer",
      "minimum": 0,
      "description": "Risk score from `validations/<sha>/risk-score.json` at review time."
    },
    "findings": {
      "type": "array",
      "description": "Ordered list of findings. Each finding may cite a registered rule_id or be an LLM-only observation (rule_id = null).",
      "items": {
        "$ref": "#/$defs/finding"
      }
    },
    "ac_coverage": {
      "type": "object",
      "description": "Map of acceptance URN to coverage status. Every acceptance_ref in the WMBT must appear as a key. Coverage status: `covered` | `not_covered` | `partial`.",
      "additionalProperties": false,
      "patternProperties": {
        "^acc:": {
          "type": "string",
          "enum": ["covered", "not_covered", "partial"]
        }
      }
    },
    "summary": {
      "type": "string",
      "minLength": 1,
      "description": "Free-form human-readable summary of the review."
    },
    "recommendations": {
      "type": "array",
      "description": "Optional ordered list of remediation recommendations.",
      "items": {
        "type": "string",
        "minLength": 1
      }
    }
  },
  "$defs": {
    "finding": {
      "type": "object",
      "required": ["rule_id", "severity", "surface", "location", "acceptance_ref", "description", "evidence"],
      "additionalProperties": false,
      "properties": {
        "rule_id": {
          "type": ["string", "null"],
          "description": "Canonical rule id from the substrate registry (resolved via `bind_rule()`). Null for LLM-only findings with no registered rule."
        },
        "rule_id_legacy_alias": {
          "type": "string",
          "minLength": 1,
          "description": "Optional legacy flat-grammar alias for the rule_id. Present for backward-compatibility with older suppression markers."
        },
        "severity": {
          "type": "integer",
          "minimum": 1,
          "maximum": 5,
          "description": "Severity 1 (informational) through 5 (blocking). When rule_id is non-null, this MUST match `bind_rule(rule_id).severity`."
        },
        "disposition": {
          "type": "string",
          "enum": ["strict", "suppress-and-clean", "advisory", "documentation-only"],
          "description": "Required when rule_id is non-null. MUST match `bind_rule(rule_id).disposition`. Null/absent for LLM-only findings."
        },
        "surface": {
          "type": "string",
          "enum": ["convention", "task", "semantic", "architecture"],
          "description": "The review surface this finding was observed on."
        },
        "location": {
          "type": "string",
          "minLength": 1,
          "description": "File path, URN, or other locator for the finding."
        },
        "acceptance_ref": {
          "type": "string",
          "minLength": 1,
          "description": "Acceptance URN this finding relates to (e.g. `acc:review-phase-boundaries:D002-UNIT-001-review-report-schema-committed`)."
        },
        "description": {
          "type": "string",
          "minLength": 1,
          "description": "Human-readable description of the finding."
        },
        "evidence": {
          "type": "string",
          "minLength": 1,
          "description": "Verbatim evidence supporting the finding (e.g. a log excerpt, code snippet, or validator output)."
        }
      }
    }
  }
}
