{
  "review_id": "rev-001-clean-pass",
  "target_commit": "abc1234",
  "reviewer_agent_id": "reviewer-v9-no-write",
  "wmbt_urn": "wmbt:review-phase-boundaries:D002",
  "phase": "GREEN",
  "verdict": "pass",
  "tier1_risk_score": 0,
  "findings": [],
  "ac_coverage": {
    "acc:review-phase-boundaries:D002-UNIT-001-review-report-schema-committed": "covered",
    "acc:review-phase-boundaries:D002-UNIT-002-pass-blocked-when-ac-not-covered": "covered",
    "acc:review-phase-boundaries:D002-UNIT-003-pass-blocked-with-strict-finding": "covered",
    "acc:review-phase-boundaries:D002-UNIT-004-rule-id-severity-matches-registry": "covered"
  },
  "summary": "All acceptances covered, no findings.",
  "recommendations": []
}
