{
  "review_id": "rev-002-concern",
  "target_commit": "abc1234",
  "reviewer_agent_id": "reviewer-v9-no-write",
  "wmbt_urn": "wmbt:review-phase-boundaries:D002",
  "phase": "GREEN",
  "verdict": "concern",
  "tier1_risk_score": 5,
  "findings": [
    {
      "rule_id": null,
      "severity": 2,
      "surface": "semantic",
      "location": "src/atdd/coach/schemas/review-report.schema.json",
      "acceptance_ref": "acc:review-phase-boundaries:D002-UNIT-001-review-report-schema-committed",
      "description": "Schema description could be more explicit about hard-rule interaction.",
      "evidence": "The description mentions hard rules but does not enumerate them."
    }
  ],
  "ac_coverage": {
    "acc:review-phase-boundaries:D002-UNIT-001-review-report-schema-committed": "covered",
    "acc:review-phase-boundaries:D002-UNIT-002-pass-blocked-when-ac-not-covered": "covered",
    "acc:review-phase-boundaries:D002-UNIT-003-pass-blocked-with-strict-finding": "covered",
    "acc:review-phase-boundaries:D002-UNIT-004-rule-id-severity-matches-registry": "partial"
  },
  "summary": "Partial coverage on UNIT-004; low-severity semantic finding.",
  "recommendations": ["Clarify hard-rule enumeration in schema description."]
}
